{
  "schema_id": "gait.runpack.run",
  "schema_version": "1.0.0",
  "created_at": "2026-02-05T00:00:00Z",
  "producer_version": "0.0.0-dev",
  "run_id": "run_demo",
  "env": { "os": "linux", "arch": "amd64", "runtime": "go" },
  "timeline": [
    {
      "event": "session_event",
      "ts": "2026-02-05T00:00:00Z",
      "ref": "trace_demo",
      "relationship": {
        "parent_ref": { "kind": "run", "id": "run_demo" },
        "entity_refs": [
          { "kind": "trace", "id": "trace_demo" },
          { "kind": "tool", "id": "tool.write" }
        ],
        "edges": [
          {
            "kind": "derived_from",
            "from": { "kind": "trace", "id": "trace_demo" },
            "to": { "kind": "run", "id": "run_demo" }
          }
        ]
      }
    }
  ]
}
